{
  "format": "vedic-pack-content",
  "format_version": 1,
  "pack_id": "bhagavad-gita",
  "revision": 1,
  "languages": ["sa", "hi", "en"],
  "licences": [
    { "id": "gita-sa", "name": "Bhagavad Gītā, Sanskrit text", "attribution": "Sanskrit text." },
    { "id": "gita-en", "name": "English translation", "attribution": "Test translation." }
  ],
  "voices": [
    { "id": "vagdhenu-m1", "name": "Vāgdhenu", "language": "sa", "style": "chant", "engine": "vagdhenu@2026-06-17", "licence": "gita-sa" }
  ],
  "works": [
    {
      "slug": "bhagavad-gita",
      "kind": "scripture",
      "title": { "sa": "श्रीमद्भगवद्गीता", "en": "Bhagavad Gītā" },
      "original_language": "sa",
      "script": "Deva",
      "licence": "gita-sa",
      "front_matter": [
        { "ref": "invocation", "kind": "prose", "lines": ["॥ ॐ श्री परमात्मने नमः ॥"] }
      ],
      "sections": [
        {
          "kind": "chapter",
          "number": "2",
          "title": { "sa": "साङ्ख्ययोगः", "en": "The Yoga of Knowledge" },
          "passages": [
            {
              "ref": "2.47",
              "kind": "verse",
              "label": "2.47",
              "speaker": { "sa": "श्रीभगवानुवाच", "en": "The Blessed Lord said" },
              "lines": [
                "कर्मण्येवाधिकारस्ते मा फलेषु कदाचन ।",
                "मा कर्मफलहेतुर्भूर्मा ते सङ्गोऽस्त्वकर्मणि ॥"
              ],
              "meter": "anuṣṭubh",
              "translations": [
                { "language": "en", "text": "Test English rendering of 2.47.", "licence": "gita-en" },
                { "language": "hi", "text": "2.47 का परीक्षण अनुवाद।", "licence": "gita-sa", "origin": "machine" }
              ],
              "variants": ["सङ्गोऽस्त्वकर्मणि"],
              "audio": [
                { "voice": "vagdhenu-m1", "file": "audio/vagdhenu-m1/2/2.47.m4a", "mime": "audio/mp4", "duration_ms": 11840, "size": 95123, "sha256": "0000000000000000000000000000000000000000000000000000000000000000" }
              ]
            }
          ]
        }
      ]
    }
  ]
}
